{
  "$schema": "https://json-schema.org/draft/2020-12/schema",
  "$id": "https://clip-factory.local/contracts/WorkflowInput/1.0.0",
  "title": "WorkflowInput",
  "type": "object",
  "additionalProperties": false,
  "required": [
    "schemaVersion",
    "workflowId",
    "projectId",
    "sourceAssetId",
    "mode",
    "languageTag",
    "maxClipSeconds",
    "platformPreset",
    "analysis",
    "requestedAt"
  ],
  "properties": {
    "schemaVersion": {
      "const": "1.0.0"
    },
    "workflowId": {
      "type": "string",
      "format": "uuid"
    },
    "projectId": {
      "type": "string",
      "format": "uuid"
    },
    "sourceAssetId": {
      "type": "string",
      "format": "uuid"
    },
    "mode": {
      "enum": ["AI_HIGHLIGHTS", "MANUAL"]
    },
    "languageTag": {
      "type": "string",
      "pattern": "^[A-Za-z]{2,3}(?:-[A-Za-z0-9]{2,8})*$"
    },
    "maxClipSeconds": {
      "type": "integer",
      "minimum": 1,
      "maximum": 10800
    },
    "platformPreset": {
      "enum": ["YOUTUBE_SHORTS", "INSTAGRAM_REELS", "TIKTOK"]
    },
    "analysis": {
      "anyOf": [
        {
          "type": "object",
          "additionalProperties": false,
          "required": [
            "modelId",
            "reasoning",
            "budgetMicrousd",
            "maximumClips",
            "instruction",
            "coverageStartMs",
            "coverageEndMs"
          ],
          "properties": {
            "modelId": {
              "enum": ["gpt-5.6-sol", "gpt-5.5"]
            },
            "reasoning": {
              "enum": ["none", "low", "medium", "high", "xhigh", "max"]
            },
            "budgetMicrousd": {
              "type": "integer",
              "minimum": 0
            },
            "maximumClips": {
              "type": "integer",
              "minimum": 1,
              "maximum": 50
            },
            "instruction": {
              "anyOf": [
                {
                  "type": "string",
                  "maxLength": 2000
                },
                {
                  "type": "null"
                }
              ]
            },
            "coverageStartMs": {
              "type": "integer",
              "minimum": 0
            },
            "coverageEndMs": {
              "type": "integer",
              "minimum": 0
            }
          },
          "allOf": [
            {
              "if": {
                "properties": {
                  "modelId": {
                    "const": "gpt-5.6-sol"
                  }
                },
                "required": ["modelId"]
              },
              "then": {
                "properties": {
                  "reasoning": {
                    "enum": ["none", "low", "medium", "high", "xhigh", "max"]
                  }
                }
              }
            },
            {
              "if": {
                "properties": {
                  "modelId": {
                    "const": "gpt-5.5"
                  }
                },
                "required": ["modelId"]
              },
              "then": {
                "properties": {
                  "reasoning": {
                    "enum": ["none", "low", "medium", "high", "xhigh"]
                  }
                }
              }
            }
          ]
        },
        {
          "type": "null"
        }
      ]
    },
    "requestedAt": {
      "type": "string",
      "format": "date-time"
    }
  }
}
