{
  "schemaVersion": "1.0.0",
  "workflowId": "00000000-0000-4000-8000-000000000001",
  "projectId": "00000000-0000-4000-8000-000000000002",
  "sourceAssetId": "00000000-0000-4000-8000-000000000003",
  "mode": "MANUAL",
  "languageTag": "en",
  "maxClipSeconds": 60,
  "platformPreset": "YOUTUBE_SHORTS",
  "analysis": null,
  "requestedAt": "2026-07-11T00:00:00Z"
}
